username,num_of_stars,review,time
Jibz,5,I love this jacket so much!! Perfect for a rainy spring dogwalk! And easy to pack up if you get too warm and the rain stops :),2 days ago
Coastal Gal,5,[This review was collected as part of a promotion.] Nice rain jacket. Wasn’t sure on size but went with the larger size so I could layer and is perfect.,a month ago
Kathy0946,5,"Fit runs SMALL, especially if you might wear it over a long sleeve shirt and a sweater or flannel shirt.",a month ago
Shelly81,5,[This review was collected as part of a promotion.] This is a very comfortable jacket that will keep you dry. I am very pleased with my purchase.,2 months ago
Amanda D,5,[This review was collected as part of a promotion.] Gorgeous color and fit! Such high quality! Can’t wait to wear it. True to size!!,2 months ago
ctequestrian,5,"[This review was collected as part of a promotion.] I haven't put this jacket to the full test of a drenching rain yet, but it's breathable and waterproof on the initial wear. I wish it was a little longer, but other than that, it seems like a great choice.",2 months ago
Mel's Husband,5,[This review was collected as part of a promotion.] Great summer rain jacket in a great color. Helps block the wind and keep you dry.,2 months ago
Anonymous,5,[This review was collected as part of a promotion.] My daughter is an avid walker and needed a light weight but reliable rain proof jacket. She especially likes the chin and hood cap for complete coverage.,3 months ago
Columbia Kid,5,Very comfortable fit. Nice colour and fit. Only wore it once after Christmas but it provided protection in a light rain.,3 months ago
LBH,5,"[This review was collected as part of a promotion.] This is the third Columbia rain jacket I’ve purchased in the last 6 months. This one was a gift for my daughter. The quality and design is always consistent. It is the only breathable, waterproof raincoat I will ever own! Love the Acadia line.",3 months ago
Marline,5,"[This review was collected as part of a promotion.] This jacket is sleek, perfect for the rain and wind. Fits true to size. Can dress it up or down!",3 months ago
Mark,5,[This review was collected as part of a promotion.] Gave this to my Wife for Xmas. She LOVES is and it is perfect for everything she wanted.,3 months ago
Terry,5,[This review was collected as part of a promotion.] This appears to be a well-made rain jacket. The lining seems adequate for being waterproof. It’s very lightweight which is what I wanted. It is true to size.,3 months ago
Ouarda amimer,5,"[This review was collected as part of a promotion.] I bought the jacket for my daughter, fit to size great quality and material. She loved it.",3 months ago
momof3,5,I was so excited to get this jacket but the large fits like a medium. So I am returning it.,4 months ago
M,5,[This review was collected as part of a promotion.] Oh my goodness. The raincoat is amazing!!! I loved the pockets and it was cozy when I layered myself with other sweaters. The color is amazing and the fit was wonderful,4 months ago
Becca,5,[This review was collected as part of a promotion.] This rain jacket is perfect used in downpours at a theme park and out camping and it kept me dry.,4 months ago
Barb,5,"[This review was collected as part of a promotion.] Very nice jacket. I haven't needed it yet, as the rain ended before it arrived 🙂 I love the slightly longer fit, and ordered one size too large to fit it over a sweatshirt on cold rainy days.",5 months ago
M S P,5,[This review was collected as part of a promotion.] Quality Rain Jacket. Beautiful Cobalt Blue Color Shipping Time was as quoted when I ordered.,5 months ago
Michelle1988776,5,"Perfect for rainy fall days, quickly dries and protects against the wind.",5 months ago
KL,5,I love this jacket! It takes a beating with the rain in Oregon and not once have I’ve been wet. This is my 2nd one as I wore out the other one,5 months ago
Shares S,5,"Perfect jacket for rainy weather. It’s breathable material makes it more comfortable, not like a plastic bag.",5 months ago
DD in Carmel,5,"I wore this jacket everyday for two weeks while we were in Scotland (September 2023), and it was absolutely perfect! Temperature was between 55 and 65 Fahrenheit everyday, with rain everyday too. I wore a T-shirt and a scarf and was quite comfortable. The hood is fantastic and did not really need an umbrella at all. My husband got the men's version before we left too, and he was quite happy with it as well. Nice wind-breaker too.",6 months ago
Dodi,5,Just what I was looking for! I had a similar one that was my go to jacket. I lost it in May while on vacation. I’ve been searching but haven’t found the same one. This one is really close. Good fit and looks good. My only complaint is it took a little longer to get here than expected. But all good!,6 months ago
Anonymous,5,This jacket is well made and exactly as pictured and described. I bought my normal size and it’s a good fit. I’m expecting to wear light layers under in moderate weather. I love the color 🩷,6 months ago
Karosett,5,"This is my second Columbia rain jacket as I have another one in the color of watermelon. I would like one in every color. The fit is perfect, the hood stays in place instead of falling over your eyes, and those Velcro tabs really work. Best of all…..it keeps you dry. Recently I had to walk three blocks in a torrential down pour and my top half did not get wet!",8 months ago
ROSAFARI,5,"This is the perfecr, lighweight, easy to pack, rain jacket,.for safari and photo expeditions into the rain forest",8 months ago
n/a,5,"Fits well, comfortable, applicable for all-weather!",8 months ago
Elaine,5,Very comfortable. I ordered large but probably could have got away with a medium. I love the colour!,8 months ago
swhe,5,"lightweight, stylish, comfortable, love the hood!!",8 months ago
CKB,5,Purchased this for an Alaskan cruise in August. I think it will be perfect. I usually like XL..but with no stretch exchanged for XXL so i can wear layers underneath. I think i will get much use from this jacket. Great quality and love the color,8 months ago
Bevgo,5,"Light weight, beautiful color, fits well. Haven't had a chance to wear it in the rain yet but material feels like it wouldn't absorb the rain. I will likely wear it as a light windbreaker even when it is not raining. Love that it blends in with the environment so I can wear it while photographing in nature.",8 months ago
Mara555,5,This is the perfect lightweight rain jacket with a hood. Great for warm weather or could be layered underneath for cooler days. It's adjustable along the waist and the sleeve cuffs. It comes in a variety of colors. Packs easily for travel.,8 months ago
Pam P.,5,Wonderful rain jacket! It is lightweight but durable and very comfortable even in the summer heat.,9 months ago
Violet S.,5,"I am thrilled with the quality, fit and style of this jacket. I got the Dark Sapphire and it is a perfect shade that is somewhat neutral/versatile and will combine well with the warmer, earthy, golden tones I tend to wear. I plan to take this on a Spring trip to Japan, I just can tell it will travel well and do what it’s supposed to do in rain and wind. The length is great - not too short like so many windbreaker jackets. I am size 4-6 with somewhat broad shoulders. The small fits perfectly, roomy enough but still looks flattering. Excellent detailing too, a smart wardrobe piece. Well done, Columbia!",10 months ago
Heather G,5,"Nice light rain jacket, I was looking for something not bulky, easy to pack down and 100% waterproof. This jacket nails is on all points for me and the blue color is great imo.",11 months ago
Louise,5,Haven't worn it in the rain yet but fits well and LOVE the color!!,11 months ago
Nahide,5,"I liked very much this raincoat. I bought three this year. The colourscare so beatiful, so you can not choose only one. I will wear spring and autumn.",11 months ago
Washington Mom,5,I love the color and fit of this jacket. I've had many different rain jackets but this one isn't too warm and keeps me dry,a year ago
Seaside,5,"Nice length, not too short. Lightweight and room enough to add layers. Love the colour.",a year ago
Lynda M,5,"I bought this coat for golf. Loved it so much that I was wearing it every day, so I came back and bought a second one. Now I can leave one in my golf bag and never get caught without one.",a year ago
Laurie,5,bought as gift and came in a few days as promised.,a year ago
Chanel,5,"[This review was collected as part of a promotion.] Love this jacket! It’s lightweight, super comfortable and looks great! Highly recommend!",a year ago
G’ma Joan,5,"This jacket is perfect for rainy, windy weather. It keeps me dry and looks good.",a year ago
Jessica,5,"[This review was collected as part of a promotion.] I love this jacket. I got it in a size large, which I am definitely happy about. I can wear a hoodie or sweatshirt underneath without feeling restriction!",a year ago
Agustina,5,[This review was collected as part of a promotion.] Comfortable jacket. Protect the wind special in windy day.,a year ago
SDS,5,All of my coworkers have this raincoat and I was always stealing theirs on days with heavy rain ( we are outside a lot for our job). I decided to invest in my own since I’ve been enjoying theirs for years!,a year ago
Richard,5,I have a rain jacket from Columbia and love it. It is light weight and convenient. My wife uses it some . So I decided to buy one for her. She loves it and glad I got got the same brand.,a year ago
J Massey,5,This is the perfect rain protection. It protects nicely from the rain and is a great windbreaker otherwise. Feels good and looks good.,a year ago
Columbia Fan,5,"I bought this jacket in preparation for a trip to theme parks where I anticipated getting drenched on water rides. It is extremely light weight while still being surprisingly warm. This has become my favorite jacket that I wear all winter long. If the temperature really drops, I wear another jacket underneath. The densely woven fabric will keep you warm while the inner layer of mesh keeps you dry. This really has become my favorite jacket. I now own three, just to have them in multiple colors.",a year ago
Alley,5,"Great, reliable material. Shipped quickly. Fits perfectly!",a year ago
Sheska,5,"Really good product. If you are a large, order it XL because is a little tight.",a year ago
Mom,5,The jacket fits true to size. My teenage daughter loves the dark blue color it’s beautiful.,a year ago
CC,5,"Good price and good quality. Have only worn in light rain and it does its job! I wish the hood could be adjusted. Otherwise, just what I was looking for!",a year ago
Angela,5,"I love this jacket so much I had to buy a second one! I wore my old one before it got a small hole in it to a concert early in the summer and literally sat in the rain for 3 hours before the show started. I was as dry as could be under this jacket. When I discovered the small hole in it after the concert, and couldn't find a patch kit for it, I bought a second jacket and also bought the matching pants as I plan on using these for backpacking too. I can't say enough about how nice and dry I was. The jacket also acts as a windbreaker as well. Living in Washington state, I'm questioning why I didn't discover this jacket years ago!!! Worth every penny if you're looking to stay truly dry :-)",a year ago
Anna,5,Love this jacket! It’s exactly what I wanted. The colour and fit is perfect. And the price was great too! Super happy with this purchase :),a year ago
Oana,5,Great jacket! Completely waterproof. I love the colour and it fits perfectly,a year ago
Lee,5,"The jacket runs a tad small (XL), fortunately it fits nicely. The pink color is pretty. I've not worn it in a heavy rain, but it was good in a drizzle.",a year ago
mhandzlik,5,"Exactly as described - lightweight, breathable, perfect for Seattle light rain in the summer.",a year ago
Mayra,5,Really satisfied with my new jacket. I tried it under the tap and it was really waterproofing! Loved it!,a year ago
Bunny,5,"I ordered this as I was preparing to return to the muggy, humid, and thunderstorm-y reaches of central Ohio, needing something both breathable and waterproof, as well as light and packable enough to be carried around in a satchel. I was curious to see how Columbia's Omni-Tech compares to the plain Gore-Tex of past jackets I've had. I've forgone my umbrella a few times in order to see how well it works, and I'm very pleased. The jacket's hood stays up reasonably well even in hilltop winds, and it's as waterproof as I'd hoped (no more getting drenched in surprise downpours!). It's compressible, and on days when I don't have a bag, the fabric isn't too slippery for me to tie it around my waist. In humidity, it does okay in terms of breathability, though anything gets sweaty if you're moving around a lot and exerting yourself in that weather (in which case the rain is more a relief than anything). It also makes an excellent windbreaker. On top of all that, it escaped the petty issue I've had with past raincoats: it wasn't unbearably noisy! It crinkles a bit, but it doesn't sound like someone is crumpling paper in my ear when the hood is up. A small thing, but much appreciated! My only complaint would be that, even when fully loosened, it can feel tight around the hips (mine are fairly wide), and wearers with wider hips or larger stomachs might find that a hindrance. All in all, though, a very well-made jacket.",a year ago
Dora P,5,Perfect rain jacket!! Breathable and dries quickly. Tested it out over the weekend.. got caught in a major rainfall and very impressed with the water protection. I definitely recommend.,a year ago
SeattleSue,5,"I go back to this jacket whenever I need a new one. I think this is my 3rd in 10 years, and I've never worn one out, just changed sizes. The construction is great: it keeps me dry and comfortable and it's practically all-season for the PNW. The fabric is what I would consider somewhere between light and medium weight. The mesh lining keeps it from being clammy in warmer temps so in the summer I use it as a windbreaker on the water or in the mountains. The closed seams mean it also keeps me dry and warm when used as an outer layer in cooler temps during spring/fall/winter. It keeps the rain off and I like the adjustable hood. The fit isn't too slim or too bulky--just right! For me, (5'4"") the length is perfect, hitting just below the hips; being shorter, I also appreciate the ability to velcro the cuffs tighter so they aren't too long. Zippers are strong and durable. Best of all, it rolls up nice and compact for stuffing into your pack or luggage--perfect travel jacket!",a year ago
Kylie J,5,Lightweight rain jacket that easily folds up into it's own mesh pocket for easy stowing. Love this - I keep it in my car for those pop-up Florida showers.,a year ago
Annalyse,5,Love this product! Just had to order a new one. Highly Recommend!,a year ago
Sophie S,5,Cute color (peach) and truly waterproof! Bought for layering for skiing but wearing as a light jacket on rainy days too.,a year ago
Picky Shopper,5,My picky daughter loves it. It's fit her very nice.,a year ago
Rylee W,5,"Lightweight, breathable, and waterproof. Just what I was looking for!",a year ago
Dee,5,"I bought this in Safari for a summer trip to Iceland, and it was PERFECT. It was easy to layer, lightweight, and it kept me completely dry. I love that it folds up. I hooked a keychain loop on the zipper of the left pocket (which is where it's folded into) so I could hook it onto my backpack. My only complaint is that there was nothing that explained that to fold the jacket you just shove it into the left pocket, which is an extremely minor complaint. I have no regrets with this purchase, and I fully expect to be wearing it on and off the trail!",a year ago
Stacie,5,Love the color and fit. I normally wear a large but purchased an XL because I want to be able to wear something heavy under it in the fall and winter so it will work nicely. I probably could have gone with a large and it would have been fine it is very generous. I do wish that the material was a little thicker just to give it a little weight but over all very good quality. The length of the jacket is good and the sleeve length is long so the velcro comes in handy to adjust them. I think I will get a lot of use out of this jacket in all 4 seasons. I purchased a the soft shell to wear under it in spring and fall and it will be perfect!,a year ago
N Gee,5,"A nice lightweight and breathable rain jacket. It's the perfect design, fun and stylish.",a year ago
Val,5,Good fit and quality. Columbia can trust to fit well.,a year ago
Paula,5,"Love it. Light jacket, very useful in warmer days when it is raining. Size follows same standards as other Columbia products.",a year ago
Elaine,5,Love the color and it fits perfectly. Color is titled 'Safari' & I will be using the jacket in the Amazon wilds!,a year ago
Reviewer,5,"I enjoy wearing this jacket. Very light and color is very popular among my friends. I sometimes have to walk the dog in rain and garden, it protects me from getting wet. I'm also very happy with xs sizing. I wear petite 2 and this was very good fit. Sleeves were long but there is a velcro to fasten to adjust the length. Very good quality and I'm very satisfied with the purchase.",a year ago
Kathy A,5,I love this rain jacket I have worn it several times for my walks on rainy days. It works well keeps you dry and is breathable very comfortable . Love the look and the colour I am very happy with my purchase .,a year ago
Kat,5,"I've been eyeing a Columbia rain jacket for awhile now and so glad I got one. Material is so great. It holds up wonderfully in even a downpour! I typically wear a large in shirts, so was thinking I would get an XL, but when I tried them on at the store, the Large in this jacket fit perfectly. The color is so beautiful, so will definitely feel stylish even in the rain!",2 years ago
Linda,5,I have had this jacket before and I misplaced it-I really missed it! I purchased a new one and I am really pleased,2 years ago
JenK,5,"I'm 5'2, 198# and bought the XXL. I love this jacket. It's been a while since I've owned a proper rain jacket and this works for me. I chose geranium because why not - it's a rain jacket and odds are it's an overcast day so I need to be seen. The fit is great, the zipper (so far) is sturdy. I've worn it more in the snowfall while taking out the dogs. Roomy pockets and quick to dry. I think will be good in summer and plan to take it with me on hikes.",2 years ago
Gator Girl,5,"I have 2 of these jackets: Black & Navy. My best friend loves my jacket so I bought her one for christmas. Jacket keeps you dry- it's a ""real"" rainjacket vs all the others that leak through material. It's lightweight and comfortable. Some rain jackets feel like plastic... this jacket fits good and doesn't feel like a plastic bag. I would highly recommend it to anyone. If I had any negative it would be to improve the hood- if it had an elastic cloth hoodie attached to the main hood, it would stay forward on your head better and keep the rain off your head better. I also wish they would offer other colors, like Pink, turquoise , etc.",2 years ago
Twin mom,5,"I have 2 of these jackets now, I love them. Keeps me dry and stops the wind!",2 years ago
Chris M,5,It’s comfortable and fits well. Exactly still wanted Excellent service assistance in placing my order,2 years ago
Tati,5,"This rain jacket is absolutely perfect! The sizing is just ride and the color is just as it appears on the website! Coming from a not so rainy city to a very rainy college town has me stuck at what jacket to get since I've never owned one, but this was an amazing pick I made! Can't wait to get a few more in other colors!",2 years ago
LauraW,5,"Bought this jacket a few months ago, I love how light weight it is, great for the spring/fall weather.",2 years ago
ida,5,is waterproof and not too heavy so you can take it wherever you want. I was not cold when i wore a hoodie or sweater under it,2 years ago
Lizi,5,This train jacket is lightweight and very eager resistant. Exactly the product I was looking for/ wanted.,2 years ago
Melissa,5,"I bought this jacket for a vacation where we did a lot of hiking. I was looking for a jacket that was waterproof and wind resistant. This jacket lived up to all my expectations. It kept me dry especially when the wind started blowing the rain. The only things I would change are zipper and add an inside pocket. I wish I could have unzipped the bottom, this would have made it easier bending down to tie shoes or picking up items easier.",2 years ago
Erin,5,"I had a Columbia rain jacket like this for years and wore it to tatters, plan to do the same for this one. I wanted the teal color but waited too long and it sold out in my size but actually the peach is gorgeous and I'm glad I got that one instead. Perfect for layering on my morning walks, I love how lightweight it is.",2 years ago
anna22,5,"I bought this knowing I would need it for football practice and training, but I have used it for so much more. The fit is amazing and the material is so lightweight that I forget I am even wearing it!",2 years ago
MJ,5,"Completely waterproof, comfy and easy to pack. Great lightweight rain jacket.",2 years ago
OutdoorFan,5,"I bought this rain jacket for my wife (who walks daily, rain or shine). Her former jacket left her coming in soggy all the way through, but now she stays dry through the heaviest of downpours. Points!!!",2 years ago
Vic Ky,5,I love this jacket. Bought it for a vacation since the area is known for rainfall out of nowhere. Fits well in most areas but snug on my breast (if you’re bigger than a 38DD(E) size up) I like a bit of tightness their though so I’m happy.,2 years ago
Ab,5,"My husband and I bought Columbia rain jackets for our trip to Iceland on a bit of a splurge for our budget, and we did not regret it. All I can say is that this rain jacket performed as well as any rain jacket up against those odds could. It was totally awesome. The only time it started to give out was when the rain combined with 30mph wind was basically sending stinging water bullets at us. Other than that I used it up to 5 hours at a time in heavy rain and it was just barely starting to get a bit waterlogged by the time we got out of the rain. It is super fast drying (we had only the confines of a camper van to hang clothes in), and works fabulously as a windbreaker. Overall, I would 100% buy this again in the same circumstances. The light blue color was so pretty!",2 years ago
maya m,5,i love rhis jacket so comfy and definitely water proof. fits me really well i ordered xs. long enough and big enough for me to grow. i am 87 pounds and 5'2 for reference. love the jacket love the fit love the look,2 years ago
M,5,"A great, lightweight rain jacket that definitely keeps you dry!",2 years ago
Sandy,5,Exactly what the description says - light rain proof jacket. This item is true to size. This was exactly what i was looking for! Very happy with jacket!,2 years ago
Amy,5,I love it it fits perfect I am wearing it now and it’s warm and keeps me dry from rain,2 years ago
Kmorgan086,5,Great quality and awesome to run in! It's perfect!,2 years ago
Hiker,5,Love this thing. Really breaks the wind and really fits inside it’s pocket!!!,3 years ago
MM,5,"Great jacket, kept me dry! Great for layering, blocks off wind.",3 years ago
qris,5,"Bought this for my wife, she likes the fit. Water repellency and quality is high. Doesn't have pit zips but not expected at this price.",3 years ago
Naty,5,Gery good and comfortable jacket. I Recommend to a people .,3 years ago
Ellie,5,It is my favourite jacket ever. I wear it everyday and very easy to wash. I get lots of compliments too.,3 years ago
JC,5,Love this jacket so much bought another one in a different color.,3 years ago
Bre'a,5,The cut is a bit boxy but all in all a great lightweight jacket. I get compliments all the time on the color. Excellent for spring or summer and a change of pace for winters in Northern California. Pairs well with anything!,3 years ago
Teri,5,Bought it as a gift. Was pleased with my own Columbia jacket and wanted to share.,3 years ago
AE,5,The perfect jacket for the mild drizzly Seattle weather,3 years ago
E Holmes,5,"Comfortable fit, great price. Nice color selection too.",3 years ago
C,5,It’s so comfy and perfect for rainy & cold weather!,3 years ago
Jane C,5,Packable and breathable rain jacket keeping you completely dry. Like the length and side zip pockets for holding items securely. Pretty color that isn't too bright or bold,3 years ago
Vivian,5,I love this jacket very much! It is perfect to wear on a wet day with its brightly tender colour and definitely waterproof fabric!,3 years ago
Madeleine,5,"Has kept me dry so far, nice color and fit. Just a little short above the bum",3 years ago
Cat,5,I am very pleased with my purchase! I wasn't sure how the fit would be as I am normally a petite medium but the medium was perfect. I love that the jacket stuffs into its own pocket and makes it easy to pack for inclement weather.,3 years ago
Ellie,5,I love this coat so much make sure if you buy it you go one size up! It really is true to size as in it will fit like a shirt so if you’re a small or a six got up to a medium and it will give you much better space and you can wear a sweater with it. I love the colour and shipping was super fast. Over all if you’re thinking about this.... get it!!!,3 years ago
Kat74,5,"This is a great jacket, BUT, order a size up if you’re planning to layer. I’m 5’5” 157 lbs, and ordered the large. It’s fine alone, but not for layering. I’m returning for an XL.",3 years ago
